{
  "carrera": "Ingeniería en Informática",
  "contrato": "1.0.0",
  "electivas": {
    "creditos_requeridos": 27
  },
  "materias": [
    {
      "ciclo": "profesional",
      "codigo": "72.45",
      "correlativas": [],
      "creditos": 12,
      "creditos_requeridos": 160,
      "cuatrimestre_sugerido": 9,
      "minors": [],
      "nombre": "Proyecto Final",
      "vigente": true
    }
  ],
  "minors": [
    {
      "creditos_minimos": 14,
      "nombre": "Ciencia de Datos",
      "sigla": "CD"
    },
    {
      "creditos_minimos": 14,
      "nombre": "Inteligencia Artificial",
      "sigla": "IA"
    },
    {
      "creditos_minimos": 14,
      "nombre": "Imágenes y Realidad Virtual",
      "sigla": "IRV"
    },
    {
      "creditos_minimos": 14,
      "nombre": "Arquitectura de Software",
      "sigla": "ARQ"
    }
  ],
  "plan": "S10-Rev23",
  "titulos": [
    {
      "creditos": 147,
      "id": "analista",
      "nombre": "Analista en Tecnología Informática",
      "requiere_ciclos": [
        "basico"
      ],
      "tipo": "intermedio"
    },
    {
      "creditos": 192,
      "id": "bachiller",
      "nombre": "Bachiller en Ingeniería",
      "requiere_ciclos": [
        "basico"
      ],
      "tipo": "intermedio"
    },
    {
      "creditos": 243,
      "id": "ingeniero",
      "nombre": "Ingeniero/a en Informática",
      "requiere_ciclos": [
        "basico",
        "profesional"
      ],
      "requiere_electivas": 27,
      "tipo": "principal"
    }
  ]
}
